{
  "showcase_id": "ho-det-001-capability-visual-data-pack-v1",
  "artifact_id": "HO-DET-001",
  "product": "Hoxline by HawkinsOperations",
  "category": "ProofOps",
  "doctrine": {
    "primary": "AI is not the authority. Evidence is.",
    "control_plane": "Hoxline controls what AI-assisted security work is allowed to become.",
    "proof_boundary": "Hoxline is not proof authority.",
    "website_boundary": "Website rendering is not proof."
  },
  "proof_ceiling": "CONTROLLED_TEST_VALIDATED",
  "public_safe": false,
  "human_review_required": true,
  "current_safe_claim": "HO-DET-001 has controlled validation evidence under stated scope and remains bounded by its proof ceiling.",
  "executive_summary": "Hoxline can run the HO-DET-001 ProofOps loop, package reviewer-readable outputs, verify the output contract, preserve the controlled-validation proof ceiling, and keep stronger claims gated when evidence is missing.",
  "positive_capabilities": [
    {
      "id": "canonical-proofops-loop",
      "capability": "Hoxline can run the canonical ProofOps loop for HO-DET-001.",
      "evidence": "examples/gauntlet/ho-det-001-full-loop-run-v0.json"
    },
    {
      "id": "reviewer-json",
      "capability": "Hoxline can emit reviewer-readable JSON.",
      "evidence": "examples/gauntlet/ho-det-001-full-loop-run-v0.json"
    },
    {
      "id": "reviewer-markdown",
      "capability": "Hoxline can emit reviewer-readable Markdown.",
      "evidence": "examples/gauntlet/ho-det-001-full-loop-run-v0.md"
    },
    {
      "id": "output-contract-verification",
      "capability": "Hoxline can verify the Gauntlet full-loop output contract.",
      "evidence": "schemas/gauntlet-full-loop-run-v0.schema.json"
    },
    {
      "id": "proof-ceiling-preservation",
      "capability": "Hoxline can preserve the CONTROLLED_TEST_VALIDATED proof ceiling.",
      "evidence": "examples/gauntlet/ho-det-001-full-loop-run-v0.json"
    },
    {
      "id": "safe-claim-mapping",
      "capability": "Hoxline can map artifact state to allowed claim wording.",
      "evidence": "examples/gauntlet/ho-det-001-proofcard-v0.json"
    },
    {
      "id": "blocked-claim-mapping",
      "capability": "Hoxline can map blocked claim families to safer wording and missing evidence.",
      "evidence": "examples/gauntlet/ho-det-001-full-loop-run-v0.json"
    },
    {
      "id": "runtime-signal-gating",
      "capability": "Hoxline can keep runtime and signal gated when evidence is missing.",
      "evidence": "examples/gauntlet/ho-det-001-full-loop-run-v0.json"
    },
    {
      "id": "authority-separation",
      "capability": "Hoxline can represent authority separation across the seven-repo system.",
      "evidence": "README.md"
    },
    {
      "id": "single-artifact-story",
      "capability": "Hoxline can show one artifact, one loop, one safe claim, and blocked stronger claims.",
      "evidence": "docs/gauntlet/HO_DET_001_GAUNTLET_RUN.md"
    }
  ],
  "loop_stage_statuses": [
    {
      "order": 1,
      "stage": "AI-assisted security work",
      "status": "REFERENCE_ONLY",
      "status_group": "reference",
      "authority_surface": "hoxline",
      "reviewer_note": "Artifact is treated as referenced AI-assisted security work; AI is not authority."
    },
    {
      "order": 2,
      "stage": "Artifact Intake",
      "status": "PASS",
      "status_group": "working",
      "authority_surface": "hoxline",
      "reviewer_note": "Artifact intake is accepted for this controlled run."
    },
    {
      "order": 3,
      "stage": "Evidence Graph",
      "status": "PASS",
      "status_group": "working",
      "authority_surface": "hoxline",
      "reviewer_note": "Evidence graph example links the artifact through the loop."
    },
    {
      "order": 4,
      "stage": "Telemetry Contract Check",
      "status": "PASS",
      "status_group": "working",
      "authority_surface": "hawkinsoperations-platform",
      "reviewer_note": "Telemetry contract support is referenced from source-truth artifacts."
    },
    {
      "order": 5,
      "stage": "Controlled Validation",
      "status": "PASS",
      "status_group": "working",
      "authority_surface": "hawkinsoperations-validation",
      "reviewer_note": "Controlled validation is limited to controlled positive and negative process-creation fixtures."
    },
    {
      "order": 6,
      "stage": "Runtime Candidate Ledger",
      "status": "BLOCKED",
      "status_group": "gated",
      "authority_surface": "hoxline",
      "reviewer_note": "Runtime evidence is missing; this run does not claim runtime-active status."
    },
    {
      "order": 7,
      "stage": "Signal Observation",
      "status": "MISSING_EVIDENCE",
      "status_group": "gated",
      "authority_surface": "hoxline",
      "reviewer_note": "Signal evidence is missing; this run does not claim signal observed status."
    },
    {
      "order": 8,
      "stage": "Human Review Gate",
      "status": "HUMAN_REVIEW_REQUIRED",
      "status_group": "review",
      "authority_surface": "hoxline",
      "reviewer_note": "Human review remains required; no final authorization claim is made."
    },
    {
      "order": 9,
      "stage": "ProofCard",
      "status": "PASS",
      "status_group": "working",
      "authority_surface": "hawkinsoperations-proof",
      "reviewer_note": "ProofCard v0 exists as a reviewer bridge, not proof authority."
    },
    {
      "order": 10,
      "stage": "Claim Authority",
      "status": "PASS",
      "status_group": "working",
      "authority_surface": "hoxline",
      "reviewer_note": "Claim Authority preserves allowed wording and blocked wording boundaries."
    },
    {
      "order": 11,
      "stage": "Safe Claim / Blocked Claim",
      "status": "PASS",
      "status_group": "working",
      "authority_surface": "hoxline",
      "reviewer_note": "Safe and blocked outputs are present under the controlled-validation proof ceiling."
    }
  ],
  "generated_outputs": [
    {
      "output_type": "json",
      "path": "examples/gauntlet/ho-det-001-full-loop-run-v0.json",
      "target_reader": "reviewer or website data loader"
    },
    {
      "output_type": "markdown",
      "path": "examples/gauntlet/ho-det-001-full-loop-run-v0.md",
      "target_reader": "human reviewer"
    },
    {
      "output_type": "schema",
      "path": "schemas/gauntlet-full-loop-run-v0.schema.json",
      "target_reader": "contract verifier"
    },
    {
      "output_type": "schema",
      "path": "schemas/capability-visual-data-pack-v1.schema.json",
      "target_reader": "website data loader"
    }
  ],
  "validation_metrics": {
    "canonical_loop_stages": {
      "value": 11,
      "status": "measured",
      "source": "examples/gauntlet/ho-det-001-full-loop-run-v0.json"
    },
    "authority_surfaces": {
      "value": 7,
      "status": "measured",
      "source": "README.md"
    },
    "generated_reviewer_outputs": {
      "value": 2,
      "status": "measured",
      "source": "examples/gauntlet"
    },
    "proof_ceiling": {
      "value": "CONTROLLED_TEST_VALIDATED",
      "status": "measured",
      "source": "examples/gauntlet/ho-det-001-full-loop-run-v0.json"
    },
    "public_safe": {
      "value": false,
      "status": "measured",
      "source": "examples/gauntlet/ho-det-001-full-loop-run-v0.json"
    },
    "human_review_required": {
      "value": true,
      "status": "measured",
      "source": "examples/gauntlet/ho-det-001-full-loop-run-v0.json"
    },
    "runtime_status": {
      "value": "BLOCKED",
      "status": "measured",
      "source": "examples/gauntlet/ho-det-001-full-loop-run-v0.json"
    },
    "signal_status": {
      "value": "MISSING_EVIDENCE",
      "status": "measured",
      "source": "examples/gauntlet/ho-det-001-full-loop-run-v0.json"
    },
    "pytest_count_current": {
      "value": 53,
      "status": "measured",
      "source": "capability visual data pack validation run"
    },
    "output_contract_tests": {
      "value": 8,
      "status": "measured",
      "source": "tests/test_hoxline_gauntlet.py"
    },
    "controlled_validation_positives": {
      "value": 7,
      "status": "measured",
      "source": "docs/gauntlet/HO_DET_001_GAUNTLET_RUN.md"
    },
    "controlled_validation_negatives": {
      "value": 7,
      "status": "measured",
      "source": "docs/gauntlet/HO_DET_001_GAUNTLET_RUN.md"
    },
    "matched_positives": {
      "value": 7,
      "status": "measured",
      "source": "docs/gauntlet/HO_DET_001_GAUNTLET_RUN.md"
    },
    "missed_positives": {
      "value": 0,
      "status": "measured",
      "source": "docs/gauntlet/HO_DET_001_GAUNTLET_RUN.md"
    },
    "false_positive_negatives": {
      "value": 0,
      "status": "measured",
      "source": "docs/gauntlet/HO_DET_001_GAUNTLET_RUN.md"
    }
  },
  "contract_metrics": {
    "gauntlet_output_schema": "schemas/gauntlet-full-loop-run-v0.schema.json",
    "visual_data_pack_schema": "schemas/capability-visual-data-pack-v1.schema.json",
    "verify_command": "$env:PYTHONPATH='src'; python -B -m hoxline gauntlet verify --input examples/gauntlet/ho-det-001-full-loop-run-v0.json",
    "required_gauntlet_fields": 13,
    "contract_test_count": 8
  },
  "claim_authority_metrics": {
    "safe_claim_count": 1,
    "blocked_claim_family_count": 23,
    "safer_wording_available": true,
    "missing_evidence_available": true,
    "public_safe": false
  },
  "authority_surfaces": [
    {
      "repo": ".github",
      "surface": "organization workflow metadata",
      "owns": "organization-level repository coordination",
      "does_not_own": "artifact proof status",
      "visual_group": "governance"
    },
    {
      "repo": "hawkinsoperations-detections",
      "surface": "detection source",
      "owns": "detection rule and status source references",
      "does_not_own": "public-safe release claims",
      "visual_group": "source"
    },
    {